reviews_by_same_job_cons,reviews_by_same_job_pros,company_benefits_employer_summary,employee_benefit_reviews
"[""too much corpo culture brought to day to day work""]","[""Good culture"",""Good management culture is good office is awesome work life balance"",""Principle based management style."",""Good pay, consistent work, friendly people"",""Good culture good pay and promotion prospects""]","We believe your opportunities should fit your gifts and abilities so you can be rewarded for valuable contributions you make. We also look to provide benefit choices aligned with individual values and personal situations because we know health and wellness is important to you. This allows us to provide the right support, no matter what Koch company you work for, or where you live around the globe. (Benefits vary by location.)
Health &amp; Wellness
We prioritize wellness with great medical, dental, vision, life insurance and disability coverage. Our health plan options are customized to fit the lifestyles of our global employees and include numerous life-balancing tools like virtual visits, a 24/7 nurse line, family counseling and other assistance programs.
Financial Resilience
Get valuable resources and budgeting tools to boost your financial health. Options vary by location, but can include 401(k) matching, tuition reimbursement, financial coaches, legal counsel, health savings accounts, flexible spending accounts, life insurance and disability coverage.
Contribution-Based Rewards
We are motivated to maximize our individual contributions – and it’s always great to get rewarded for them. We expect every supervisor and employee to work together to continually strive for better – which often leads to exponential growth.
Families First
Quality care is essential for healthy, growing families. Beyond our core benefits, we offer employees and their loved ones a broad range of regionally tailored support, including maternity and paternity leave, adoption assistance, fertility treatment coverage and other dedicated resources.
Flexible Work
Everyone has individual work and personal needs, and flexible work is a benefit valued by many. We seek to enable the best work environment that helps you and the business work together to produce superior results.
Lifelong Learning
Continuous learning is an expectation because your career journey is ever-changing. With a focus on the individual, we find new ways to develop our skills and abilities, whether it’s through conferences, classes or higher education. We provide the support and assistance each person needs to grow.","[""3 weeks PTO starting increasing with YoS. 6% 401k match after first year. Additional 3% 401k contribution from day 1"",""Health insurance is great, 8 free counselling sessions for all employees and families in household every year. Vacation time could be more."",""great benefits, health, 401k, etc""]"
"[""Low pay and more targets to meet"",""no benefits or complain support for seasonal or contract employees"",""Long hours and can be difficult working all night if you’re not used to it."",""Management was poor and the responsibility to pay ratio did not seem adequate"",""Bad work culture and hectic schedules""]","[""Pay is good and fair"",""Good benefits and flexibility !"",""Flexible hours and great with students."",""management and pay were great"",""The work culture is good and I never felt that I was new in the company""]",,"[""Full benefits and scholarship options for career advancement are nice. "",""Benefits are OKAY... Considering they are one of 5 largest companies in the world, they could be a lot better when it comes to monthly premiums, 401k matching, and deductible amounts. If you work as a driver or warehouse worker for more than a year, you can be almost certain that you will be using your medical insurance. No sick days,  all of your PTO accrues by June for the whole year, and its very hard save it for when you really need it during 6-10 weeks of peak season working mandatory 60 hour weeks. "",""Car rentals, hotels, and flights are extremely cheap when searching from internal Amazon benefit site""]"
"[""Less benefits compared to the rest of the competition ."",""cult like culture"",""The Salary isn't great at all.""]","[""good benefits"",""Competent Colleagues"",""Great growth and culture in the company"",""Decent Salary"",""Nice &amp; beautiful office""]","At Celonis, we want to empower Celonauts to stay at their best and enable personal and professional growth by supporting their physical, mental and financial wellbeing throughout their life journey, whilst also giving back to the wider community and planet Earth. We do this by providing a comprehensive benefits program and additional perks to all Celonauts (employees) in&nbsp;the United States.","[""401k, unlimited vacation \nLimited health insurance "",""truly spectacular paternity leave benefits"",""Medical insurance could be better for families, otherwise, pretty good perks""]"
"[""They don't call everybody only certain people just like the recent Christmas party was only lead men oh I know I've heard all of it just enough nepotism favoritism family"",""No hours""]","[""Good benefits"",""The pay is good . . ."",""Good people to work with""]",,"[""They offer a wide variety of benefits. They are, however, pretty pricey."",""The Benefits premiums are expensive."",""401k is what they offer""]"
"[""Lack of organisational structure and clear paths for career progression"",""Salary not too high and promotion is slow."",""Standard benefits package, not at all competitive.""]","[""salary in 14th of month"",""Great atmosphere established by empowering (first line) managers"",""Extremely competent colleagues with market knowledge and top notch technical skills in data science""]",,"[""Great benefits! Good PTO accrual system. "",""not great vacation and sick time off "",""Vacation has to be accrued even if negotiated up front""]"
"[""Product Leadership has no boundaries or respect for typical work hours and will message employees at all hours of the day."",""It’s impossible to do a job well and meet expectations when there is so much change and micromanagement."",""Since then, everyone that could have provided mentorship to those around them were either fired or left because they were not being treated as kind as newer team members.""]","[""Within Product, leadership is making a material investment in teams and people which is really refreshing!"",""The people here have been so welcoming.""]",,"[""Benefits are up to industry standards"",""Average benefits package in line with the industry. Changed to unlimited PTO with very little notice which didn't allow all accrued time to be utilized."",""Great 401k match and competitive benefit premiums""]"
"[""Pay is not good for position level"",""no benefits, overheads by company"",""NETFLIX culture seems amazing and friendly on the surface, but it's actually a little mean and cloaked in \""NETFLIX speech\"" and comportment."",""Failed keeping young and smart people."",""Senior leadership has so little work to do that they cause chaos and micromanage in order to justify their million dollar salaries.""]","[""The pay was good for entry level"",""Good benefits."",""Amazing culture and very diverse."",""Pays well, good people to work with"",""Good leadership""]",,"[""The benefits for health were amazing. "",""Incredibly comprehensive and supportive of me as a whole person"",""good experience as an intern""]"
"[""CEO is not farsighted."",""Option is a joke when the company cannot move forward and people left like crazy"",""Bad diversity""]","[""CEO is mission driven"",""Lots of flexibility and freedom in work.""]",,"[""The benefits at NewsBreak are very good.  I have a family of four, and the cost for health, vision, dental is very fair."",""Top-tier 401(K) plan with company matching"",""Company is continuously trying to improve on benefits package.""]"
"[""Poor management, lousy pay, fake promises, always wanting more hours from you."",""CEO is trying too hard to be a member of the sales team, company is being pushed to grow faster than supply can allow""]","[""Fun coworkers, good location, fun projects""]",,"[""Care about the people.  They are always working to find new benefits.  Paid Jury Duty, scaling time off based on longevity, company performance bonuses, housing and childcare advocacy.  "",""Competitive benefits. Nomad cares about its employees!"",""The health insurance options are not the greatest offered. At this time, they only offer high deductibles and premiums. The dental is fair but the vision only has one provider in-network around the area. The 401K offers a 4% safe-harbor match. Vacation time is a standard 2-3 weeks per year. ""]"
"[""Horrible 401K""]","[""Pay is average."",""Overtime, coworkers are friendly, free insurance after 7 continuous years with the company"",""Pay is good, and managers are nice and helpful,""]",,"[""Full medical with free dental and vision insurance"",""After 7 years of employment, insurance is covered 100%"",""Free after 7 years of employment""]"
"[""IC PMs really bear the brunt of work here, as well as the blame for anything that isn't perfect, with very little accountability from the managers."",""Very very bad work culture and leadership.""]","[""Nice people Not a lot of politics"",""Competitive compensation"",""good benefits and pay and growth too""]",,"[""Good health insurance with 💯 covered for employees "",""Health insurance and quarterly wellness stipend are great."",""They offer great wellness benefits, including reimbursement of gym equipment.""]"
[],"[""The company culture is so positive and everyone brings an enthusiasm to solve problems with a customer focus.""]","
Competitive compensation
Stock options
Unlimited PTO &amp; 10 Paid Holidays
Retirement benefits (401K with traditional and Roth options)
Comprehensive health benefits (including medical, dental, and vision)
Health Savings Account (with employer contributions)
Flexible Spending Account and Dependent Care Spending Account
Life insurance (employer paid)
Paid maternity leave
Commuter benefits
Growth opportunities working with our leadership team as we expand
Fully stocked kitchen
Open office with customizable workspace (Mac computers, adjustable standing desk and extra monitors)
Great location in the heart of SoHo
","[""Great benefits for a startup! 401K match is awesome (if you contribute 5%, they match 4%). Also appreciate they offer HSA. \n"",""Its good -- unlimited PTO"",""401 K, Health Insurance is expensive!""]"
"[""The culture is not good""]","[""Great people, willing to take on new ways of thinking to improve."",""The office is nice in mid boston"",""Company has good benefits."",""Good Pay""]",,"[""Great severance after many years of faithful service.\nInteresting changes coming to Haemo, stay tuned!"",""It's comparable to others out there."",""Average benefit for the company size""]"
"[""toxic culture ."",""Not a lot of career progression for clerical staff"",""Poor management Low staff numbers""]","[""Passionate, collaborative people."",""Flight Benefits are ok if you can get on""]",,"[""Four weeks of vacation accrue from day 1! Great way to utilize the flight benefits :)"",""Company matches 6% 401k paid time off/vacation = 4 weeks per year AND they want you to take it and great medical ""]"
"[""Horrible work life balance"",""Pay is below market rate"",""Most challenging management I’ve ever experienced."",""Large organization takes a bit of time to get to know, but people are friendly and helpful""]","[""The organization is looking to grow and offer more perks to staff including Peloton benefits, counseling, etc. Very good work/life balance."",""The Benefits are good but pricey"",""The pay is better than most for a remote position."",""Excellent management."",""People are nice and willing to help out initially""]","Total Rewards
At Healthfirst, we provide a Total Rewards program that allows us to attract, engage and retain talented team members who embody our culture and share our commitment to provide the highest quality healthcare and related services to our members.
Health and Wellness
Our benefits packages include health and wellness benefits, as well as additional employee perks.&nbsp;

Health benefits include:&nbsp;

Medical, Dental, and Vision plan options
Wellness credits
Spring Health mental wellness program
Maternity, Bereavement, and Short Term/Long Term Disability leave options
Additional optional health coverage plans


Wellness benefits include:

Paid Time Off
9 Paid holidays, and 6 early office closure days
Social Justice day
Free Peloton App membership and discounts on bikes and treadmills
Health Food Cafes


Employee perks include:

401k with up to 6% match after 1 year
Annual incentive and merit increase potential
Tuition reimbursement for approved degree programs and certifications
Discounts and deals on travel, select memberships, and other special offers
Free online learning through our Employee Learning Platform



&nbsp;","[""healthfirst offers great benefits for its employees \n"",""Good benefits, low salary compared to market "",""This company offers a great benefit package ""]"
"[""Your pay isn't much higher than those you mange."",""Poor work life balance, unrecognized contributions to team"",""Old building with need for renovation""]","[""Good salary, pay, and benefits"",""good pay, looks good on resume"",""Good People"",""Great work life balance and experience.""]",,"[""Excellent Benefits provided for full family medical, prescription, dental and eye care."",""Great 401K Match and company stock options"",""no pension plan available anymore""]"
"[""Management doesn't listen to employees."",""Working long hours, start time is between 3am""]","[""Good pay and benefits as well as a few jard working people"",""Great benefits, average pay."",""Coworkers are easy to get along with and can be very helpful at times.""]","At Johnson Brothers, we prioritize team member well-being with comprehensive benefits, including medical, dental, and vision plans, flexible spending accounts, and life and accident insurance. We offer short and long-term disability coverage, access to financial wellness tools, and an employee assistance program. Our 401(k) plan includes an employer match. Additional benefits include paid time off, holidays, parental leave programs, and more. Team member wellness is central to our values, and we are committed to providing benefits that support a healthy work-life balance.","[""Mostly great benefits. Wish spousal health insurance wasn’t so pricy, but it’s hard to get away from that. Otherwise awesome."",""The company has a Good 401k match"",""Great 401k match, great vacation time""]"
"[""No work life balance"",""low salary"",""There are good managers and above, who are very supportive, but good TLs are few and far between."",""The whole culture is bad,"",""Diminished benefit Very little leaves Hard to convert to perm staff""]","[""Good culture Flexible Good work life balance"",""Good salary, even if you don't have any knowledge or experience about the work before."",""Too few to list Notice that all the favorable reviews recently are by majority of managers and directors?"",""Good culture, chance to learn new tech stack"",""Benefits and welfare are good and sufficient""]","I'm safe, I belong, I matter.&nbsp;
Part of the journey to make Equinix a place of safety, belonging, and meaning for everyone is our commitment to your wellbeing. Your health and happiness are our highest priority, and we're always working to offer the best benefit options that are comprehensive, innovative and affordable.&nbsp;&nbsp;
Your healthEquinix employees receive excellent health care and counseling plans that vary by country to ensure the well-being of you and your family. We offer paid vacations and holidays and encourage community involvement year-round via volunteer opportunities.
Your familySpending time with your loved ones and taking care of your family are important. Equinix provides a range of country-specific programs that ensure you have the resources needed to thrive and manage your family’s needs.
Your futureEquinix offers different programs to help you build your financial security, make charitable donations and seek additional education. In many countries we also offer a flexible employee stock purchase plan.
There are benefits in place to support you at work, home, and in play.&nbsp;&nbsp;
We have different providers for different benefits, and benefits can be updated or changed at different times of the year. Some benefits can only be updated during the annual open enrollment window, while others can be updated at any time.","[""Benefits are equinix are incredible"",""Great Place to be all times"",""Good health benefits, 401K, espp,etc. not much else""]"
"[""No benefits if youre prn employee"",""Below average pay compared to the market"",""Parking was expensive and difficult to find"",""Within a research lab, work culture was not positive starting with PIs."",""Although, the company provides an annual training in which they encourage innovation, unparalleled service, etc.""]","[""Good benefits frat people and values"",""Good pay for research assistant, especially considering low cost of living"",""Culture is good I suppose"",""Adequate training.""]","Choosing a career path with Houston Methodist means doing your best and receiving the best in return. We are proud to reward your exceptional commitment, skills and talents with an array of benefits and programs designed to enhance your life. Offering so many ways to be healthy, wealthy and wise, Houston Methodist invites you to learn more about the advantages the Houston Methodist team experiences every day.Wellness Programs

Employees may participate in a variety of wellness programs that promote a healthier lifestyle.
","[""Great benefits and competitive salary. "",""Covers all my family’s needs"",""A little expensive but worth it""]"
"[""Low pay and more targets to meet"",""no benefits or complain support for seasonal or contract employees"",""Long hours and can be difficult working all night if you’re not used to it."",""Management was poor and the responsibility to pay ratio did not seem adequate"",""Bad work culture and hectic schedules""]","[""Pay is good and fair"",""Good benefits and flexibility !"",""Flexible hours and great with students."",""management and pay were great"",""The work culture is good and I never felt that I was new in the company""]",,"[""Full benefits and scholarship options for career advancement are nice. "",""Benefits are OKAY... Considering they are one of 5 largest companies in the world, they could be a lot better when it comes to monthly premiums, 401k matching, and deductible amounts. If you work as a driver or warehouse worker for more than a year, you can be almost certain that you will be using your medical insurance. No sick days,  all of your PTO accrues by June for the whole year, and its very hard save it for when you really need it during 6-10 weeks of peak season working mandatory 60 hour weeks. "",""Car rentals, hotels, and flights are extremely cheap when searching from internal Amazon benefit site""]"
"[""Work life balance is average"",""Little career guidance No big benefits"",""Low pay considering the current economy."",""After merger, work culture became bad with micro managing by managers"",""Experienced people leaving in droves.""]","[""Work life balance is good"",""Good benefit and lift balance."",""Decent pay"",""Good culture and flexible policy"",""Fun and fast Paced with great people.""]",,"[""Free movie screenings every now and then "",""The benefits were amazing! From discounted telephone and cable services, to matching 401(k), to paid infertility treatments - I couldn't have asked for more. "",""various options, competitive but not top of the line like other media or tech companies ""]"
"[""No cons but the fact is the people are still working"",""Low pay"",""Work life balance is a challenge, good amount of nepotism"",""Benefits and Hike is less"",""Bad working hours, bad leadership""]","[""The people are great."",""Competitive pay"",""Good working environment, Work life balance."",""Benefits are good, There is opportunity if you can find the time to apply.""]",,"[""It was just fine, nothing special."",""401 k match is great"",""Limited 401k with matching only once per year.  ""]"
"[""Substandard base pay, raises, and bonus""]","[""Decent benefits"",""Respectful colleagues"",""Great team, work life balance, and collaboration.""]","NYSTEC Total Rewards 
We encourage, support, and compensate our employees based on our philosophy of Total Rewards. In addition to financial compensation, NYSTEC’s Total Rewards program believes in providing its employees the opportunity to excel and advance in their field, provide meaningful work, contribute to the community, work cooperatively and productively with colleagues, and balance work life duties.","[""Generous 403b match, 20 PTO days which increase with years of service, tuition reimbursement, professional development reimbursement, savings or student loan matching, fitness reimbursement"",""401k is good. Pay isn’t that of industry standards. Upper management is allowed too much leeway as far as what employees are paid, even with pay grades. "",""Benefits package is standard overall for an office environment. It's sold to employees as being an exemplary Total Rewards Package but it's essentially the same package you can get at any company. These are the main differences compared to other companies:\n\nPros: They usually give an additional payment to your retirement account if NYSTEC does well that year. There's a gift each quarter and an annual gift. Mobile phone is paid for up to a specified amount.\n\nCons: You can use Cigna providers if you travel outside of the Capital District but you're locked into MVP within the Albany area. Work/life balance is not guaranteed and depends on how well the project is negotiated when the contract is signed and how much your practice leader supports their team--you will be expected to make up for this by working more with less. Merit increases are not based on an objective process.\n\nSince the majority of the projects are with state and local government clients, the benefits should compete with what you would receive as a civil servant. If you tell employees that you pay less than other consulting firms because the benefits are amazing, shouldn't the benefits be better than what our clients receive and also significantly better than what you can get at other firms? ""]"
"[""IC PMs really bear the brunt of work here, as well as the blame for anything that isn't perfect, with very little accountability from the managers."",""Very very bad work culture and leadership.""]","[""Nice people Not a lot of politics"",""Competitive compensation"",""good benefits and pay and growth too""]",,"[""Good health insurance with 💯 covered for employees "",""Health insurance and quarterly wellness stipend are great."",""They offer great wellness benefits, including reimbursement of gym equipment.""]"
"[""Long hours and never ending busy season"",""Other benefits aren't market leading"",""not enough pay but the job is great.""]","[""Flexible hours and good co"",""Good pension benefits and nice culture to work in"",""It is a stable work environment""]",,"[""Good Health Insurance, Life Insurance and 401k.\nHard to take time off"",""Options for health insurance and generous contribution to 401k."",""So far so good, no complaints yet""]"
"[""Little guidance, direction for managers""]","[""Great benefits"",""Flexible with scheduling conflicts"",""Money is not bad."",""Full upper management involvement and support""]","At Ellis Island, Casino, Hotel, Brewery, and Village Pubs, we prioritize the well-being and satisfaction of our team members. We understand that a supportive work environment and excellent benefits are crucial to fostering a motivated and productive team. Here’s what you can expect when you join us:
Health and Wellness:&nbsp;Your well-being matters to us. We provide medical insurance, dental insurance, vision insurance, basic life insurance, a short-term disability plan, and a combo plan that provides support in case of accidents, hospitalizations, and critical illnesses.
Retirement Savings:&nbsp;Plan for your future with our 401(k) retirement savings plan, after one year of successful employment.
Work-Life Balance:&nbsp;We offer paid time off because we value your personal&nbsp;time.
Professional Development:&nbsp;Grow your career with us. We support continuous learning and offer opportunities for growth and development.
Employee Assistance Program (EAP):&nbsp;We partner with Behavioral Healthcare Options through The Life Connection (TLC) employee assistance and work-life program to provide mental health and counseling services.
Employee Discounts and Perks:&nbsp;Enjoy a free meal during your shift, free on-site parking. and employee discounts company-wide.
Diversity and Inclusion:&nbsp;We embrace diversity and foster an inclusive workplace where every voice is heard and valued.","[""The best thing about is, for me it’s easy to find out who can help with my benefits "",""Competitive Medical Insurance, Free Parking and Lunch""]"
"[""Demanding, lots of bureaucracy, low morale"",""not incentives or bonus"",""Not enough resources or support or training.""]","[""Flexible hours, company vehicle, field work"",""Wonderful young people""]",,"[""403B has  a 7% return"",""The bad thing is sub-substitute does not receive pay during vacation. It is terrible 🙁"",""There was good communication all around.""]"
