reviews_by_same_job_cons,reviews_by_same_job_pros,company_benefits_employer_summary,employee_benefit_reviews
"[""Pay is below market average and city's salary average."",""Toxic management, little to no training"",""This experience was very different from my past employment at UTHealth which I really enjoyed.""]","[""The benefits along with the job flexibility were good."",""Great people (plus or minus the usual \""special\"" more challenging people)"",""Flexibility Decent Pay Healthcare Benefits Supportive Team (every team is different)""]",,"[""Dental Plan worst Part, A lot of Paid Time Off a Plus "",""Everything was great and affordable."",""It was great and cool""]"
"[""The culture is not good""]","[""Great people, willing to take on new ways of thinking to improve."",""The office is nice in mid boston"",""Company has good benefits."",""Good Pay""]",,"[""Great severance after many years of faithful service.\nInteresting changes coming to Haemo, stay tuned!"",""It's comparable to others out there."",""Average benefit for the company size""]"
"[""Hectic working hours and no work life balance"",""Pay is low compared to market"",""Work culture is toxic here"",""Not good for ambitious people."",""Bad management.""]","[""Work Life Balance is Good"",""Good pay and growth with learning"",""1) work culture is good"",""Good people and work experience."",""management is good and hours are ok""]",,"[""Benefits arent great especially health insurance "",""Good benefits , 401(k), PTO , Health Benefits"",""Paid holidays are included as a summer intern.""]"
"[""No work life balance"",""low salary"",""There are good managers and above, who are very supportive, but good TLs are few and far between."",""The whole culture is bad,"",""Diminished benefit Very little leaves Hard to convert to perm staff""]","[""Good culture Flexible Good work life balance"",""Good salary, even if you don't have any knowledge or experience about the work before."",""Too few to list Notice that all the favorable reviews recently are by majority of managers and directors?"",""Good culture, chance to learn new tech stack"",""Benefits and welfare are good and sufficient""]","I'm safe, I belong, I matter.&nbsp;
Part of the journey to make Equinix a place of safety, belonging, and meaning for everyone is our commitment to your wellbeing. Your health and happiness are our highest priority, and we're always working to offer the best benefit options that are comprehensive, innovative and affordable.&nbsp;&nbsp;
Your healthEquinix employees receive excellent health care and counseling plans that vary by country to ensure the well-being of you and your family. We offer paid vacations and holidays and encourage community involvement year-round via volunteer opportunities.
Your familySpending time with your loved ones and taking care of your family are important. Equinix provides a range of country-specific programs that ensure you have the resources needed to thrive and manage your family’s needs.
Your futureEquinix offers different programs to help you build your financial security, make charitable donations and seek additional education. In many countries we also offer a flexible employee stock purchase plan.
There are benefits in place to support you at work, home, and in play.&nbsp;&nbsp;
We have different providers for different benefits, and benefits can be updated or changed at different times of the year. Some benefits can only be updated during the annual open enrollment window, while others can be updated at any time.","[""Benefits are equinix are incredible"",""Great Place to be all times"",""Good health benefits, 401K, espp,etc. not much else""]"
"[""Bad culture and work environment"",""manipulative management."",""Long hours and pressure to produce"",""If you decided to leave after getting a bonus they could claw it back for up to 5 years on a gross basis.""]","[""Great place to work with a good culture"",""Office location and quality good in the U.K. Management generally good in Europe."",""focus on growth, lots of colleagues very energised""]",,"[""great employees very helpful and sweet. manager is great."",""401k, Cigna insurance, 20 PTO for junior/new joiner."",""pretty good deal and well structured plans""]"
"[""Long hours for supporting older systems.""]","[""Long hours."",""Good pay"",""Working with knowledgeable and sharp colleagues"",""I was given alot of autonomy to make decisions and engage in special projects that allowed me to grow my career."",""good medical benefits, nice working environment.""]",,"[""The best part is 401k."",""The best part is 401k."",""Regular benefits. Health insurance is not 100% covered""]"
"[""Bad culture and terrible hours."",""The people weren't very smart....I would work elsewhere if you're considering IB"",""Long hours and weekend work"",""paid and not good pay increases from year to year low diversity""]","[""Great culture and a lot of deal flow"",""Great people to work with, and job offers lots of autonomy"",""Good pay and supportive environment"",""Great Senior Management""]",,"[""great employees very helpful and sweet. manager is great."",""401k, Cigna insurance, 20 PTO for junior/new joiner."",""pretty good deal and well structured plans""]"
"[""Little to no training."",""Management is horrible, you do not feel valued as an employee.""]","[""Great leadership and training"",""Management are reliable and forward thinkers who are always adapting to the needs of employees and the company as a whole."",""People were nice and friendly"",""Great communication from management."",""Great benefits and co""]",,"[""Great benefits. Always flexible with your situation but could depend on what location you are at."",""It has everything you'd expect from an employer. Just mediocre benefits overall. Work from home makes up for it though!"",""Everything was decent but the health insurance premiums were astronomical. ""]"
"[""Low pay and more targets to meet"",""no benefits or complain support for seasonal or contract employees"",""Long hours and can be difficult working all night if you’re not used to it."",""Management was poor and the responsibility to pay ratio did not seem adequate"",""Bad work culture and hectic schedules""]","[""Pay is good and fair"",""Good benefits and flexibility !"",""Flexible hours and great with students."",""management and pay were great"",""The work culture is good and I never felt that I was new in the company""]",,"[""Full benefits and scholarship options for career advancement are nice. "",""Benefits are OKAY... Considering they are one of 5 largest companies in the world, they could be a lot better when it comes to monthly premiums, 401k matching, and deductible amounts. If you work as a driver or warehouse worker for more than a year, you can be almost certain that you will be using your medical insurance. No sick days,  all of your PTO accrues by June for the whole year, and its very hard save it for when you really need it during 6-10 weeks of peak season working mandatory 60 hour weeks. "",""Car rentals, hotels, and flights are extremely cheap when searching from internal Amazon benefit site""]"
"[""Your pay isn't much higher than those you mange."",""Poor work life balance, unrecognized contributions to team"",""Old building with need for renovation""]","[""Good salary, pay, and benefits"",""good pay, looks good on resume"",""Good People"",""Great work life balance and experience.""]",,"[""Excellent Benefits provided for full family medical, prescription, dental and eye care."",""Great 401K Match and company stock options"",""no pension plan available anymore""]"
"[""You get too much work life balance and no learning"",""Salary is low and performance is not rewarded"",""bad work culture"",""Less benefits are received."",""bad management forcing return to office""]","[""flexible and good work life balance"",""Good Salary and chill environment"",""Good work culture and policies"",""Good benefits and leave policy"",""good management and team.""]","We care about your health and happiness and we want you to be at your best. At Oracle, you’ll enjoy a competitive benefits package with a variety of customizable medical options, savings plans, and wellness programs.
We also don’t think your life should be on hold from Monday to Friday. Generous amounts of time off, flexible work options, and lots of fun employee activities are all an important part of leading a balanced a life.
Hear about flexibility from Leor, one of Oracle’s Karate Club black belts—and make sure to check out some reviews from our employees.","[""good perks, benefits in line with market, stock purchasing"",""Good average food nice !"",""Employees pay low cost for health benefits. ""]"
"[""IC PMs really bear the brunt of work here, as well as the blame for anything that isn't perfect, with very little accountability from the managers."",""Very very bad work culture and leadership.""]","[""Nice people Not a lot of politics"",""Competitive compensation"",""good benefits and pay and growth too""]",,"[""Good health insurance with 💯 covered for employees "",""Health insurance and quarterly wellness stipend are great."",""They offer great wellness benefits, including reimbursement of gym equipment.""]"
"[""Also lacks diversity"",""It does not need to be so cut throat and management is sooo awful and it starts all the way from the top.""]","[""FTS has an amazing company culture."",""FTS Has strong leadership with a fail""]",,"[""solid coverage, unlimited PTO, WFH flexibility, somewhat flexible hrs"",""Covers $500 per month of healthcare"",""Unlimited PTO, Medical, Dental, Vision, 401k with match, extra 4 weeks of parental leave after PFL is done""]"
"[""You get too much work life balance and no learning"",""Salary is low and performance is not rewarded"",""bad work culture"",""Less benefits are received."",""bad management forcing return to office""]","[""flexible and good work life balance"",""Good Salary and chill environment"",""Good work culture and policies"",""Good benefits and leave policy"",""good management and team.""]","We care about your health and happiness and we want you to be at your best. At Oracle, you’ll enjoy a competitive benefits package with a variety of customizable medical options, savings plans, and wellness programs.
We also don’t think your life should be on hold from Monday to Friday. Generous amounts of time off, flexible work options, and lots of fun employee activities are all an important part of leading a balanced a life.
Hear about flexibility from Leor, one of Oracle’s Karate Club black belts—and make sure to check out some reviews from our employees.","[""good perks, benefits in line with market, stock purchasing"",""Good average food nice !"",""Employees pay low cost for health benefits. ""]"
"[""toxic culture ."",""Not a lot of career progression for clerical staff"",""Poor management Low staff numbers""]","[""Passionate, collaborative people."",""Flight Benefits are ok if you can get on""]",,"[""Four weeks of vacation accrue from day 1! Great way to utilize the flight benefits :)"",""Company matches 6% 401k paid time off/vacation = 4 weeks per year AND they want you to take it and great medical ""]"
"[""Low pay and more targets to meet"",""no benefits or complain support for seasonal or contract employees"",""Long hours and can be difficult working all night if you’re not used to it."",""Management was poor and the responsibility to pay ratio did not seem adequate"",""Bad work culture and hectic schedules""]","[""Pay is good and fair"",""Good benefits and flexibility !"",""Flexible hours and great with students."",""management and pay were great"",""The work culture is good and I never felt that I was new in the company""]",,"[""Full benefits and scholarship options for career advancement are nice. "",""Benefits are OKAY... Considering they are one of 5 largest companies in the world, they could be a lot better when it comes to monthly premiums, 401k matching, and deductible amounts. If you work as a driver or warehouse worker for more than a year, you can be almost certain that you will be using your medical insurance. No sick days,  all of your PTO accrues by June for the whole year, and its very hard save it for when you really need it during 6-10 weeks of peak season working mandatory 60 hour weeks. "",""Car rentals, hotels, and flights are extremely cheap when searching from internal Amazon benefit site""]"
"[""They don't call everybody only certain people just like the recent Christmas party was only lead men oh I know I've heard all of it just enough nepotism favoritism family"",""No hours""]","[""Good benefits"",""The pay is good . . ."",""Good people to work with""]",,"[""They offer a wide variety of benefits. They are, however, pretty pricey."",""The Benefits premiums are expensive."",""401k is what they offer""]"
[],"[""Communication from the management, adequate salary""]",,"[""The package for a singular employee is pretty affordable and generally provides good options compared to other companies. It does get expensive as soon as you need to start adding on more people, but I think that is to be expected with any healthcare plan that exists at this point. Outside of that, the other benefits offered are very good compared to other companies out there, especially the 401k match. "",""Unlimited PTO, Lack of holidays""]"
"[""IC PMs really bear the brunt of work here, as well as the blame for anything that isn't perfect, with very little accountability from the managers."",""Very very bad work culture and leadership.""]","[""Nice people Not a lot of politics"",""Competitive compensation"",""good benefits and pay and growth too""]",,"[""Good health insurance with 💯 covered for employees "",""Health insurance and quarterly wellness stipend are great."",""They offer great wellness benefits, including reimbursement of gym equipment.""]"
"[""Medical benefits are decent, but that’s about it."",""Extremely political and lots of people willing to maintain status quo."",""Pay is average."",""lack of work life balance"",""Culture, favoritism, difficult to grow.""]","[""Great benefits and PTO policy"",""Great people and understanding personnel"",""Decent pay depending on which part of the organization you're in"",""Excellent benefits and work/life balance"",""Kaiser has a good culture""]","The benefits of working for an organization like Kaiser Permanente go beyond what might be considered traditional “benefits.” Sure, we offer competitive compensation. And our medical coverage is pretty amazing, as are our retirement plans. But it’s our commitment to caring for our employees holistically that rounds out the benefit of joining our team.Being a care-driven organization, we value health, wellness, and happiness above all and know that reaching your potential at work often starts with being your best outside of it. We recognize the benefit of wellness and work-life balance and provide many tools and resources to help our employees thrive. In fact, we’re consistently named a Best Employer for Healthy Lifestyles by the National Business Group on Health!Beyond encouraging everyone to be their best self, we also know that feeling good comes from owning your professional development. Which is why we embrace learning as a way of life. Whether you sit on the clinical, technical, or business side of our organization, you’ll be encouraged to explore your potential through career paths and educational opportunities that match your ambitions.While specific benefits vary based on location, position, scheduled hours, and representation by collective bargaining or employee groups, they generally include what you see in the summary below.","[""Somewhat difficult to seek care out of network "",""The benefits are great all around for employees and dependents "",""Great healthcare benefits, selection, HSA, Calm app, educational budget ""]"
"[""When I used to work there, one of the top managers flipped his lid and had a literal temper tantrum and chewed out an employee in front of everyone."",""CEO is the final decision maker, regardless of how large or small the decision is, which makes the approval process and projects take longer."",""Communication is very bad within the company.""]","[""There is a beautiful office with a super cool breakroom."",""Good pay, employees are mostly nice, departmental managers are good."",""Depending on the department, managers are flexible with most job responsibilities depending on your interests.""]",,"[""The benefits were fine. Nothing bad to say."",""Benefits were decent at CBS."",""Great employment perks and on-site facilities.""]"
"[""And they would expect you to offer interior design services but with the low pay of a sales associate."",""DON’T COVER MANY THINGS AND HUGE OUT OF POCKET PREMIUMS CONFLICTING DIRECTIONS DUE TO POOR MANAGEMENT Avoid this company and Williams"",""Not people friendly, promote wrong people"",""No benefits for part time.""]","[""$24 hourly pay is competitive within the market, but was reduced from $25/hour during the pandemic."",""Great management and great place to work."",""Good people and company values."",""Benefits are great and the furniture is beautiful."",""The office is beautiful, inside and outside.""]",,"[""nothing. the job and perks were awesome"",""The employee discount is decent if you're into furniture and decor. At the time it was nearly 50% off. \n"",""Designer discount is nice to have.""]"
"[""No bonus structure at all.""]","[""good people to work with""]",,"[""Paid time off…never lose it"",""dental plans need to be updated and revised"",""Full array of benefits. Great firm!""]"
"[""Management is not good they have already fixed their mindset about appreciation.""]","[""good benefit and vision and working process"",""Good work life balance"",""Amazing work culture and a dynamic company that cares about professional growth."",""Cool Management."",""Great work environment and company culture.""]",www.lenovobenefits.com,"[""4% Match 401K\nGood insurance coverage"",""6% 401(k) match, decent healthcare"",""Awesome healthcare and 401k match. Best-in-class parental leave for all parents.""]"
"[""Changes in the culture and employee morale"",""Career progression felt uncertain due to ongoing business changes and lack of clear direction""]","[""Good people to work with: clever and fun."",""the benefits are great and expansive"",""Great culture, products and leaders"",""creative atmosphere and environment, a lot of talented people""]",,"[""Free movie screenings every now and then "",""The benefits were amazing! From discounted telephone and cable services, to matching 401(k), to paid infertility treatments - I couldn't have asked for more. "",""various options, competitive but not top of the line like other media or tech companies ""]"
"[""Below Average salary, no agile attitude, bad option plan, executive team don't see the rest of the company as even, no company events"",""Management is not transparent with the employees"",""Not the best culture.""]","[""Good people all around you"",""Good salary"",""while we live in a reality of companies raising and falling, I personally feel like Tipalti has a great business model, goals and management that consistently push the company to achieve new achievements and it seems like Tipalti is going to be the best company in the solution it offers and it is going to happen fast."",""Great culture, happy hour every week, nice people and high level of r&amp;d"",""Nice benefits.""]",,"[""Benefits overall were really great."",""Not all offices have the same amount of paid holidays and benefits change per location to accommodate country regulations. If one country  mandates better benefits, it would be nice for all the offices to receive the better benefits. Even from state to state in the US it is different.  "",""None, below average perks in the overall tech industry""]"
"[""They brought their horrible culture with them and have built a team where only former NCR managers are the shot callers."",""Corporate politics, lack of flexibility, too sales centric, leaders only care about bottom line, sales treats colleagues like trash and never held accountable, acquisitions are poorly handled, IT support is non"",""Former NCR management has taken over sales and service.""]","[""Extraordinary career opportunities across the globe"",""Good benefits.""]",,"[""Not flexible by experience on PTO is strictly tenure based"",""401k match, Paid Time Off"",""Very good PTO policy and health insurance.""]"
"[""No Benefits in comparison to tech culture"",""No work life balance"",""The culture is toxic and combative."",""Low pay; not competitive with market"",""Though managers are increasingly taking a more liberal view of this policy The 3 days in the office have caused a lot of very talented people to leave and talented developers are not joining.""]","[""Benefits are good and a wealth of knowledge"",""Work life balance is good"",""Great culture and team environment."",""1. Good pay"",""Great People and""]",,"[""good benefits, generous amount of vacation time for new hires, 401k, perks out side of work."",""Great benefits package as is expected from a company this size. Industry standard across bulge bracket banks\n"",""Best is that they offer them. Worst is the cost ""]"
"[""Low salary compared to private sector""]","["";Great Benefits and good people"",""Good benefits and union job and student loan forgiveness"",""good management and flexible hours no overtime""]",,"[""Great benefits. Dental and Vision insurance could be better "",""bureaucracy and wait for a long time to get the benefit "",""The pension is great but it's really only worth it if you work for 20+ years.""]"
"[""Leadership doesn’t care."",""Extremely high turn over rate.""]","[""Good leadership"",""Good coworkers"",""There is great advancement in the company, Many employees have been there 10, 20, 30, 40 years!!"",""Nice clients""]",,"[""One of the best in the business!"",""While I worked for Mt Olivet rolling acres, my coworker told me a client of mine was dragged my his neck by an overnight staff member which, according to my coworker, left bruising. When I asked my superior if the client's parent or Central Entry Point of had been contacted I was not given a straight answer. It was a month before I saw any action and weeks even later when they fired the overnight staff member.\r\n"",""PTO was fantastic. Not having sick days and having to use you're PTO was not so fantastic.""]"
"[""Low pay, bi weekly pay""]","[""workers &amp; fun work environment"",""Good people and work indoors"",""Assembly process engineer and NPD""]",,"[""Health Insurance, 401K, Paid time off/vacation time off. "",""Free Coffee and the high retention "",""Decent health insurance, standard vacation and time off.""]"
"[""When I used to work there, one of the top managers flipped his lid and had a literal temper tantrum and chewed out an employee in front of everyone."",""CEO is the final decision maker, regardless of how large or small the decision is, which makes the approval process and projects take longer."",""Communication is very bad within the company.""]","[""There is a beautiful office with a super cool breakroom."",""Good pay, employees are mostly nice, departmental managers are good."",""Depending on the department, managers are flexible with most job responsibilities depending on your interests.""]",,"[""The benefits were fine. Nothing bad to say."",""Benefits were decent at CBS."",""Great employment perks and on-site facilities.""]"
"[""Management is angry all the time.""]","[""People I worked with were great, they ran the machines into the ground with no preventative maintenance and shut the machines down, thier efficiency is more important to them then machine health"",""LOVE IT ALL good money"",""Innovative environment, family atmosphere, positive growth potential."",""Not a lot of over time and will gain great experience working with all kinds of injection mold machines.""]",,"[""Good Benefits Health Insurance, Vision, Dental, as well as multiple other options available"",""Good benefits and experience training"",""Health insurance was expensive with high deductibles!""]"
"[""No benefits for VCC contratcs."",""Less pay"",""no work life balance at all"",""Layoffs, manager was arrogant, HR was not responsive, over workload"",""Toxic culture with a \""you are lucky to be employed\"" approach""]","[""Great benefits and that’s it"",""The pay is good"",""Flexible and good work life balance"",""If your manager and team are great, it can be a good company to work for."",""Great culture and can be sustainabrl""]",,"[""Full benefits and scholarship options for career advancement are nice. "",""Benefits are OKAY... Considering they are one of 5 largest companies in the world, they could be a lot better when it comes to monthly premiums, 401k matching, and deductible amounts. If you work as a driver or warehouse worker for more than a year, you can be almost certain that you will be using your medical insurance. No sick days,  all of your PTO accrues by June for the whole year, and its very hard save it for when you really need it during 6-10 weeks of peak season working mandatory 60 hour weeks. "",""Car rentals, hotels, and flights are extremely cheap when searching from internal Amazon benefit site""]"
