reviews_by_same_job_cons,reviews_by_same_job_pros,company_benefits_employer_summary,employee_benefit_reviews
"[""no work life balance"",""Benefits could be better as well as PTO"",""Felt pay was low and speed of work was slow"",""Higher ups could care less about people who do the work."",""Even with bad management, I would still recommend to a friend if that friend was junior to mid level.""]","[""Good work life balance mostly"",""benefits are good and start day 1"",""Good pay and stability in the workplace"",""So its a great for people who go from undergrad to grad school with minimal experience and can get a well"",""management is good.""]",Northrop Grumman provides a comprehensive benefits package and a work environment that encourages your growth and supports the mutual success of our people and our company. Northrop Grumman benefits give you the flexibility and control to choose the benefits that make the most sense for you and your family.,"[""PTO, healthcare and 401K are all offered and are all excellent options"",""Great health insurance, flexibility, and PTO."",""Decent benefits. PTO and sick time are wrapped into one benefit. ""]"
"[""Low Pay and kind of boring."",""Income management, meaning they don't want you to make to much money because they think it will kill your motivation to hustle."",""Work environment is fast""]","[""great people"",""Great opportunity to learn and grow""]","A productive and innovative workplace starts with the well-being of our employees. At iHeartMedia, the health and welfare of our team is of the utmost importance. We offer an extensive range of benefits that allow our employees to bring their best selves to work each day and we strive to continue to make iHeartMedia a great place to work:

Health &amp; Wellness: Our comprehensive benefits package includes medical, dental and vision coverage, as well as family life and accident insurance.
Time Away: Our time-off policy offers 15 paid holidays, half-days before key holidays, plus vacation.
Financial: Employees can participate in a 401(k) program.
Our benefits programs also includes a variety of flexible spending accounts.
Parental Leave: Your family is part of the iHeartMedia family. We support employees throughout their lives, including the growth of their families with our Parental Leave policy, as well as additional short-term voluntary disability.
Other benefits: We offer voluntary benefits at discounted rates, including pet, legal and auto/home insurance, as well as identity theft.
","[""Great perks.\nCould have improvements "",""Health coverage is expensive. I was better off with Covered California."",""reasonable pricing on insurance options""]"
"[""Salaries are competitive and follows market standards"",""Although the client's complete team is bigger than us working remotely."",""No proper policy where employees get benefits."",""No proper communication""]","[""If you are currently unemployed and looking for a job, please do not join this company, I would suggest you to continue interviewing and please join another one because even if you get selected, you will be fired as they have only short term projects for which they are hiring you and once the project contract ends you will he fired irrespective of your performance.""]",,"[""Good 401K, vacation, deferred compensation options"",""Competitive benefits offered but could be better"",""Competitive benefits offered but could be better""]"
"[""No work life balance, constant emails and meetings.""]","[""Flexible and work life balance"",""Exceptional benefits and insurance packages."",""Great management."",""befits were great."",""Fast paced and you learn a lot about an interesting industry.""]",,"[""None that I can think of."",""The best things is they give 3 months off for paternity/ maternity leave"",""Health Insurance was very good.""]"
"[""No work life balance and some difficult colleagues"",""Unrealistic expectations and bad culture"",""Bad benefits."",""Low pay and annoying regulatory hurdles"",""4. Terrible pressure, so attrition rate is very high, even high salary does not ensure good people to stay""]","[""Good Work Life balance and"",""Culture is good and relatively flat"",""Good benefits with a culture"",""Good pay and leaves"",""Great people and office location""]","Citi makes a significant investment to provide valuable benefit programs for all employees around the world.  These include core health, insurance and retirement programs as well as supplementary programs.
Our global benefits philosophy requires that programs should deliver quality benefits and be simple to understand, to access and communicate. Our Live Well at Citi Global Health Strategy, offers best in class wellness programs, tools and resources to help employees lead healthier lives. We strive to inspire accountability, improve health and productivity while managing our healthcare costs. Our programs are designed to support Citi’s values and help to attract, motivate and retain a diverse workforce within a collaborative work environment.","[""Healthcare is offered at higher price tag"",""Health insurance and PTO vacation "",""Vacation time was reasonable but did not like specific dates blocked""]"
"[""not much room for advancement""]","[""Good people that care about each other.""]",,"[""Good match for 401k, options for health coverage"",""You can pick and choose what you are looking for from day one"",""Decent plan through TFI Intl""]"
"[""No work life balance at all"",""My manager was very inexperienced and at times rude."",""Toxic culture.""]","[""Work life balance is great"",""Good people to work with"",""25 days of PTO."",""Great values, generous PTO, laid back managers, brilliant colleagues."",""Good culture.""]",,"[""Lots of PTO and affordable healthcare"",""The vacation benefits are great."",""Great benefits!  Amazing PTO and ability to volunteer 5 days a year!!!""]"
"[""Senior Leadership is very slow to adjust to market trends.""]","[""Benefits (product and agility allowances, 401K, 4 weeks time off)"",""Great industry and good benefits"",""Great career growth opportunity, genuinely good people, flexible environment"",""People are great, good work life balance, frequent chance to connect with people in the company""]","Our programs are tailored to support the needs of our employees and their families. We recognize the value of a diverse workforce and therefore include coverage for domestic partners and the children of domestic partners for our eligible employees.
The health and wellbeing of our employees is very important to us. We foster a culture of health through health fairs, and programs and activities that support healthy nutrition and exercise.
Product Allowance
We encourage our employees to act as ambassadors of our brands. To support this effort, eligible employees over the age of 21 have a product allowance to promote our brands with friends and family.
Additional Perks:

Flexible Work Environment
Casual dress code
Summer Fridays
Comprehensive health &amp; wellness programs
Fertility &amp; childcare benefits
Generous paid time off (including HQ being closed Christmas through New Years)
Yearly agility allowance
Tuition scholarships &amp; reimbursement programs
Weekly themed happy hours
Access to relevant and modern learning opportunities
Community outreach and charitable gifting
Company car (or allowance) for eligible roles

Please note that this is only a brief overview of Pernod Ricard USA’s benefit offerings and does not supersede the official plan document and contracts.
Visit our benefits page for more information!
PRUSA Benefits
Canada Benefits","[""good package including health insurance"",""Industry standard but diminishing levels for newer employees. Complicated annual review."",""They provide all the basic necessities and can improve on Care package.""]"
"[""not much room for advancement""]","[""Good people that care about each other.""]",,"[""Good match for 401k, options for health coverage"",""You can pick and choose what you are looking for from day one"",""Decent plan through TFI Intl""]"
"[""No cons but the fact is the people are still working"",""Low pay"",""Work life balance is a challenge, good amount of nepotism"",""Benefits and Hike is less"",""Bad working hours, bad leadership""]","[""The people are great."",""Competitive pay"",""Good working environment, Work life balance."",""Benefits are good, There is opportunity if you can find the time to apply.""]",,"[""It was just fine, nothing special."",""401 k match is great"",""Limited 401k with matching only once per year.  ""]"
"[""low salary and and and"",""Awful management, to avoid totally this company."",""Isolated from European colleagues and flat structure"",""Alot of dependency on you because of smaller size, and less work life balance"",""Terrible pay, bad culture, boring work, not very nice collegaues""]","[""good salary"",""Supportive management and good projects to work on."",""Good enviroment and nice colleagues"",""Good work life balance compared to other consultancies"",""Good culture and a relaxing environment""]",,"[""Good benefits good pay and nice people"",""Benefits are good here, no complaints. "",""Benefits are terrific.  Long hours.  ""]"
"[""Pay is below market average and city's salary average."",""Toxic management, little to no training"",""This experience was very different from my past employment at UTHealth which I really enjoyed.""]","[""The benefits along with the job flexibility were good."",""Great people (plus or minus the usual \""special\"" more challenging people)"",""Flexibility Decent Pay Healthcare Benefits Supportive Team (every team is different)""]",,"[""Dental Plan worst Part, A lot of Paid Time Off a Plus "",""Everything was great and affordable."",""It was great and cool""]"
"[""Bad culture and terrible hours."",""The people weren't very smart....I would work elsewhere if you're considering IB"",""Long hours and weekend work"",""paid and not good pay increases from year to year low diversity""]","[""Great culture and a lot of deal flow"",""Great people to work with, and job offers lots of autonomy"",""Good pay and supportive environment"",""Great Senior Management""]",,"[""great employees very helpful and sweet. manager is great."",""401k, Cigna insurance, 20 PTO for junior/new joiner."",""pretty good deal and well structured plans""]"
"[""Some of the worst corporate culture."",""No cons everyone is great""]","[""Amazing culture, collaborative peers, corporate discount"",""Excellent work life balance very friendly environment"",""Great work life balance and benefits"",""Great compensation and benefits like having the last Friday of every month off""]","Our portfolio of benefits, programs and services is designed to make sure our employees are healthy and comfortable, while encouraging creativity inside and outside of the office. Here are a few of the highlights of working at Levi Strauss &amp; Co.:
EMPLOYEE BENEFITS

HEALTH AND FITNESS: LS&amp;Co. offers competitive benefit options and a flexible plan design. Employees can handpick medical, dental, vision and life insurance plans that are right for them.
APPAREL: Corporate employees receive a discount at all company owned- and-operated stores and e-commerce sites. They may also purchase Levi’s&reg;, Dockers&reg; and Signature by Levi Strauss &amp; Co.™ apparel at a significant discount at periodic sample sales.
TECHNOLOGY AND BUSINESS SERVICES: Employees are eligible for discounts with Apple, HP, Microsoft, Staples and AT&amp;T Wireless.

Please visit our External Careers Site for more information http://www.levistrauss.com/careers/#benefits ","[""The flexibility of the job, 401k, and time management"",""Levi's lives its values and offers generous benefits. They consistently offer financial classes, donation matching, women in leadership spotlight and 401k matching at a higher percent than most companies. They truly value their employees with ERG etc..."",""Flexible health insurance options to choose""]"
"[""Management is angry all the time.""]","[""People I worked with were great, they ran the machines into the ground with no preventative maintenance and shut the machines down, thier efficiency is more important to them then machine health"",""LOVE IT ALL good money"",""Innovative environment, family atmosphere, positive growth potential."",""Not a lot of over time and will gain great experience working with all kinds of injection mold machines.""]",,"[""Good Benefits Health Insurance, Vision, Dental, as well as multiple other options available"",""Good benefits and experience training"",""Health insurance was expensive with high deductibles!""]"
"[""Low pay and more targets to meet"",""no benefits or complain support for seasonal or contract employees"",""Long hours and can be difficult working all night if you’re not used to it."",""Management was poor and the responsibility to pay ratio did not seem adequate"",""Bad work culture and hectic schedules""]","[""Pay is good and fair"",""Good benefits and flexibility !"",""Flexible hours and great with students."",""management and pay were great"",""The work culture is good and I never felt that I was new in the company""]",,"[""Full benefits and scholarship options for career advancement are nice. "",""Benefits are OKAY... Considering they are one of 5 largest companies in the world, they could be a lot better when it comes to monthly premiums, 401k matching, and deductible amounts. If you work as a driver or warehouse worker for more than a year, you can be almost certain that you will be using your medical insurance. No sick days,  all of your PTO accrues by June for the whole year, and its very hard save it for when you really need it during 6-10 weeks of peak season working mandatory 60 hour weeks. "",""Car rentals, hotels, and flights are extremely cheap when searching from internal Amazon benefit site""]"
"[""RTO culture"",""Work life balance can be challenging"",""Pay could be better.""]","[""Good culture and challenging work"",""benefits and environment are good"",""1. Pay is good"",""Great people, and much responsibility as you’re willing to take on.""]","Doing your best work means being your best self. To help, we offer a wide range of benefits and perks, some that only Uber can, to support your health and wellbeing.","[""Able to work whenever you need to"",""good benefits and nice offices"",""No good benefits for drivers""]"
"[""Horrible work life balance"",""Pay is below market rate"",""Most challenging management I’ve ever experienced."",""Large organization takes a bit of time to get to know, but people are friendly and helpful""]","[""The organization is looking to grow and offer more perks to staff including Peloton benefits, counseling, etc. Very good work/life balance."",""The Benefits are good but pricey"",""The pay is better than most for a remote position."",""Excellent management."",""People are nice and willing to help out initially""]","Total Rewards
At Healthfirst, we provide a Total Rewards program that allows us to attract, engage and retain talented team members who embody our culture and share our commitment to provide the highest quality healthcare and related services to our members.
Health and Wellness
Our benefits packages include health and wellness benefits, as well as additional employee perks.&nbsp;

Health benefits include:&nbsp;

Medical, Dental, and Vision plan options
Wellness credits
Spring Health mental wellness program
Maternity, Bereavement, and Short Term/Long Term Disability leave options
Additional optional health coverage plans


Wellness benefits include:

Paid Time Off
9 Paid holidays, and 6 early office closure days
Social Justice day
Free Peloton App membership and discounts on bikes and treadmills
Health Food Cafes


Employee perks include:

401k with up to 6% match after 1 year
Annual incentive and merit increase potential
Tuition reimbursement for approved degree programs and certifications
Discounts and deals on travel, select memberships, and other special offers
Free online learning through our Employee Learning Platform



&nbsp;","[""healthfirst offers great benefits for its employees \n"",""Good benefits, low salary compared to market "",""This company offers a great benefit package ""]"
"[""Leadership can be flippant."",""Bad culture""]","[""great culture"",""There are a lot of really great people working here and plenty of problems to solve."",""Fairly relaxing work environment"",""Professional Service driven career oriented""]",,"[""Great 401k match and monthly snack box"",""Great 401K matching and PTO policy!"",""Unlimited vacation, WFH or office.""]"
"[""Some management are not so cool."",""Pay and job mobility are bad."",""Benefits are not that wonderful (I have had WAY better in the past) and the PTO/ vacation time is sub par."",""cruddy training, watch and learn only works for some people, and learning under pressure while a patient waits is very stressful.""]","[""Management was great, accommodating and presented opportunities for advancement and to learn new skills."",""The benefits are cheap but the deductible is high so...find out where the worth is."",""Pay is decent, training is fairly efficient."",""warm welcoming culture""]",,"[""Good health and dental insurance "",""Good health and dental insurance "",""best-paid time off\nworst-not sure""]"
"[""Management is angry all the time.""]","[""People I worked with were great, they ran the machines into the ground with no preventative maintenance and shut the machines down, thier efficiency is more important to them then machine health"",""LOVE IT ALL good money"",""Innovative environment, family atmosphere, positive growth potential."",""Not a lot of over time and will gain great experience working with all kinds of injection mold machines.""]",,"[""Good Benefits Health Insurance, Vision, Dental, as well as multiple other options available"",""Good benefits and experience training"",""Health insurance was expensive with high deductibles!""]"
"[""IC PMs really bear the brunt of work here, as well as the blame for anything that isn't perfect, with very little accountability from the managers."",""Very very bad work culture and leadership.""]","[""Nice people Not a lot of politics"",""Competitive compensation"",""good benefits and pay and growth too""]",,"[""Good health insurance with 💯 covered for employees "",""Health insurance and quarterly wellness stipend are great."",""They offer great wellness benefits, including reimbursement of gym equipment.""]"
"[""The culture is not good""]","[""Great people, willing to take on new ways of thinking to improve."",""The office is nice in mid boston"",""Company has good benefits."",""Good Pay""]",,"[""Great severance after many years of faithful service.\nInteresting changes coming to Haemo, stay tuned!"",""It's comparable to others out there."",""Average benefit for the company size""]"
"[""bad leadership in the dept, no guidance with projects""]",[],,"[""Limited maternity leave, great tuition reimbursement"",""Aetna has been excellent. Cigna dental is sub par. Previous pension plan "",""Union benefits good place to work""]"
"[""Pay is not good for position level"",""no benefits, overheads by company"",""NETFLIX culture seems amazing and friendly on the surface, but it's actually a little mean and cloaked in \""NETFLIX speech\"" and comportment."",""Failed keeping young and smart people."",""Senior leadership has so little work to do that they cause chaos and micromanage in order to justify their million dollar salaries.""]","[""The pay was good for entry level"",""Good benefits."",""Amazing culture and very diverse."",""Pays well, good people to work with"",""Good leadership""]",,"[""The benefits for health were amazing. "",""Incredibly comprehensive and supportive of me as a whole person"",""good experience as an intern""]"
"[""Marginal Benefits."",""behind on technology, Manuel systems""]","[""Good work life balance and a very pro"",""The pay and benefits are decent."",""Excellent benefits, security, controls and environment."",""It is a dead end job.""]",,"[""401k, health insurance for family"",""Great company, benefits and work environment."",""Great benefits! Insurance is great and affordable.""]"
"[""Low pay and shirt breaks"",""Poor management"",""Benefits are expensive"",""Long hours and ok to moderate pay"",""They don’t care about their staff""]","[""Pay is good but that is it"",""Great management."",""Good benefits and very professional place of employment"",""flexible hours and supportive leadership"",""Great Staff and Great Patients!!""]",,"[""I cannot think of anything wrong with the benefits"",""No paid holidays is the worst part, but PTO is racked up quickly "",""Nothing offered to part time employees ""]"
"[""Pay is well below standard.""]","[""Great work life balance and great pay"",""Rich and high culture in working and relations"",""so many smart people with passion"",""good people and coworkers and nice building"",""Good benefits""]","At Stanford, you matter as much as the work
Our holistic approach to benefits helps you grow, recharge and care for yourself—and the people who matter most—at any life stage. From health, wellness and retirement to time off and educational assistance, we offer thoughtful benefits and many evidence-based perks designed to help you live your best life while doing the work of a lifetime.","[""Great retirement savings plan match and option to use doctors in the Stanford health network."",""I like the Arrillaga gym."",""Great benefits, including health insurance and retirement plans""]"
"[""Horrible work life balance"",""Pay is below market rate"",""Most challenging management I’ve ever experienced."",""Large organization takes a bit of time to get to know, but people are friendly and helpful""]","[""The organization is looking to grow and offer more perks to staff including Peloton benefits, counseling, etc. Very good work/life balance."",""The Benefits are good but pricey"",""The pay is better than most for a remote position."",""Excellent management."",""People are nice and willing to help out initially""]","Total Rewards
At Healthfirst, we provide a Total Rewards program that allows us to attract, engage and retain talented team members who embody our culture and share our commitment to provide the highest quality healthcare and related services to our members.
Health and Wellness
Our benefits packages include health and wellness benefits, as well as additional employee perks.&nbsp;

Health benefits include:&nbsp;

Medical, Dental, and Vision plan options
Wellness credits
Spring Health mental wellness program
Maternity, Bereavement, and Short Term/Long Term Disability leave options
Additional optional health coverage plans


Wellness benefits include:

Paid Time Off
9 Paid holidays, and 6 early office closure days
Social Justice day
Free Peloton App membership and discounts on bikes and treadmills
Health Food Cafes


Employee perks include:

401k with up to 6% match after 1 year
Annual incentive and merit increase potential
Tuition reimbursement for approved degree programs and certifications
Discounts and deals on travel, select memberships, and other special offers
Free online learning through our Employee Learning Platform



&nbsp;","[""healthfirst offers great benefits for its employees \n"",""Good benefits, low salary compared to market "",""This company offers a great benefit package ""]"
"[""No work life balance in India"",""Some managers Will do Some partiality and contracts employees won’t get much benefit"",""Culture depends on team and management."",""Good people"",""Less exposure to the work environment and less pay""]","[""Work life balance is good"",""Good benefits overall and nice projects"",""Awesome organization and good culture"",""Good people to work with."",""life balance with good pay and benefits""]","We care about youWe believe a stronger signal to employees is providing benefits that support signature life moments—enhanced leave and “welcome back” initiatives when an employee returns from a period of absence, bereavement support, sabbatical, educational assistance, and adoption and fertility benefits. Here's a snapshot of what we offer:

Generous time off and enhanced leave for moments that matter
Enjoy a 4-week sabbatical after five years of employment
Purchase Adobe stock at 15% below fair market value by enrolling in ESPP
Feed your brain with educational reimbursement of $10,000 USD a year

For a full breakdown, check out http://benefits.adobe.com/ for current employee benefits in the US.","[""Sabbatical holiday for 1 month every five years"",""The benefits of Adobe are great including ESPP."",""Culture is very good! Would reccomend""]"
